
         /\      Grafana   /‾‾/  
    /\  /  \     |\  __   /  /   
   /  \/    \    | |/ /  /   ‾‾\ 
  /          \   |   (  |  (‾)  |
 / __________ \  |_|\_\  \_____/ 


     execution: local
        script: k6/load-test.js
        output: -

     scenarios: (100.00%) 1 scenario, 20 max VUs, 55s max duration (incl. graceful stop):
              * product_browsing: Up to 20 looping VUs for 50s over 3 stages (gracefulRampDown: 5s, exec: productBrowsing, gracefulStop: 30s)


Run                [ 100% ] setup()
product_browsing   [   0% ]

Run                [ 100% ] setup()
product_browsing   [   0% ]

running (03.0s), 02/20 VUs, 0 complete and 0 interrupted iterations
product_browsing   [   2% ] 02/20 VUs  00.8s/50.0s

running (04.0s), 04/20 VUs, 0 complete and 0 interrupted iterations
product_browsing   [   4% ] 04/20 VUs  01.8s/50.0s

running (05.0s), 06/20 VUs, 0 complete and 0 interrupted iterations
product_browsing   [   6% ] 06/20 VUs  02.8s/50.0s

running (06.0s), 08/20 VUs, 1 complete and 0 interrupted iterations
product_browsing   [   8% ] 08/20 VUs  03.8s/50.0s

running (07.0s), 10/20 VUs, 3 complete and 0 interrupted iterations
product_browsing   [  10% ] 10/20 VUs  04.8s/50.0s

running (08.0s), 12/20 VUs, 5 complete and 0 interrupted iterations
product_browsing   [  12% ] 12/20 VUs  05.8s/50.0s

running (09.0s), 13/20 VUs, 8 complete and 0 interrupted iterations
product_browsing   [  14% ] 13/20 VUs  06.8s/50.0s

running (10.0s), 15/20 VUs, 11 complete and 0 interrupted iterations
product_browsing   [  16% ] 15/20 VUs  07.8s/50.0s

running (11.0s), 17/20 VUs, 14 complete and 0 interrupted iterations
product_browsing   [  18% ] 17/20 VUs  08.8s/50.0s

running (12.0s), 19/20 VUs, 21 complete and 0 interrupted iterations
product_browsing   [  20% ] 19/20 VUs  09.8s/50.0s

running (13.0s), 20/20 VUs, 25 complete and 0 interrupted iterations
product_browsing   [  22% ] 20/20 VUs  10.8s/50.0s

running (14.0s), 20/20 VUs, 30 complete and 0 interrupted iterations
product_browsing   [  24% ] 20/20 VUs  11.8s/50.0s

running (15.0s), 20/20 VUs, 35 complete and 0 interrupted iterations
product_browsing   [  26% ] 20/20 VUs  12.8s/50.0s

running (16.0s), 20/20 VUs, 41 complete and 0 interrupted iterations
product_browsing   [  28% ] 20/20 VUs  13.8s/50.0s

running (17.0s), 20/20 VUs, 47 complete and 0 interrupted iterations
product_browsing   [  30% ] 20/20 VUs  14.8s/50.0s

running (18.0s), 20/20 VUs, 53 complete and 0 interrupted iterations
product_browsing   [  32% ] 20/20 VUs  15.8s/50.0s

running (19.0s), 20/20 VUs, 60 complete and 0 interrupted iterations
product_browsing   [  34% ] 20/20 VUs  16.8s/50.0s

running (20.0s), 20/20 VUs, 65 complete and 0 interrupted iterations
product_browsing   [  36% ] 20/20 VUs  17.8s/50.0s

running (21.0s), 20/20 VUs, 69 complete and 0 interrupted iterations
product_browsing   [  38% ] 20/20 VUs  18.8s/50.0s

running (22.0s), 20/20 VUs, 77 complete and 0 interrupted iterations
product_browsing   [  40% ] 20/20 VUs  19.8s/50.0s

running (23.0s), 20/20 VUs, 84 complete and 0 interrupted iterations
product_browsing   [  42% ] 20/20 VUs  20.8s/50.0s

running (24.0s), 20/20 VUs, 89 complete and 0 interrupted iterations
product_browsing   [  44% ] 20/20 VUs  21.8s/50.0s

running (25.0s), 20/20 VUs, 95 complete and 0 interrupted iterations
product_browsing   [  46% ] 20/20 VUs  22.8s/50.0s

running (26.0s), 20/20 VUs, 101 complete and 0 interrupted iterations
product_browsing   [  48% ] 20/20 VUs  23.8s/50.0s

running (27.0s), 20/20 VUs, 105 complete and 0 interrupted iterations
product_browsing   [  50% ] 20/20 VUs  24.8s/50.0s

running (28.0s), 20/20 VUs, 109 complete and 0 interrupted iterations
product_browsing   [  52% ] 20/20 VUs  25.8s/50.0s

running (29.0s), 20/20 VUs, 118 complete and 0 interrupted iterations
product_browsing   [  54% ] 20/20 VUs  26.8s/50.0s

running (30.0s), 20/20 VUs, 123 complete and 0 interrupted iterations
product_browsing   [  56% ] 20/20 VUs  27.8s/50.0s

running (31.0s), 20/20 VUs, 128 complete and 0 interrupted iterations
product_browsing   [  58% ] 20/20 VUs  28.8s/50.0s

running (32.0s), 20/20 VUs, 135 complete and 0 interrupted iterations
product_browsing   [  60% ] 20/20 VUs  29.8s/50.0s

running (33.0s), 20/20 VUs, 142 complete and 0 interrupted iterations
product_browsing   [  62% ] 20/20 VUs  30.8s/50.0s

running (34.0s), 20/20 VUs, 145 complete and 0 interrupted iterations
product_browsing   [  64% ] 20/20 VUs  31.8s/50.0s

running (35.0s), 20/20 VUs, 151 complete and 0 interrupted iterations
product_browsing   [  66% ] 20/20 VUs  32.8s/50.0s

running (36.0s), 20/20 VUs, 162 complete and 0 interrupted iterations
product_browsing   [  68% ] 20/20 VUs  33.8s/50.0s

running (37.0s), 20/20 VUs, 165 complete and 0 interrupted iterations
product_browsing   [  70% ] 20/20 VUs  34.8s/50.0s

running (38.0s), 20/20 VUs, 168 complete and 0 interrupted iterations
product_browsing   [  72% ] 20/20 VUs  35.8s/50.0s

running (39.0s), 20/20 VUs, 175 complete and 0 interrupted iterations
product_browsing   [  74% ] 20/20 VUs  36.8s/50.0s

running (40.0s), 20/20 VUs, 184 complete and 0 interrupted iterations
product_browsing   [  76% ] 20/20 VUs  37.8s/50.0s

running (41.0s), 20/20 VUs, 185 complete and 0 interrupted iterations
product_browsing   [  78% ] 20/20 VUs  38.8s/50.0s

running (42.0s), 20/20 VUs, 193 complete and 0 interrupted iterations
product_browsing   [  80% ] 20/20 VUs  39.8s/50.0s

running (43.0s), 20/20 VUs, 204 complete and 0 interrupted iterations
product_browsing   [  82% ] 20/20 VUs  40.8s/50.0s

running (44.0s), 20/20 VUs, 205 complete and 0 interrupted iterations
product_browsing   [  84% ] 20/20 VUs  41.8s/50.0s

running (45.0s), 18/20 VUs, 210 complete and 0 interrupted iterations
product_browsing   [  86% ] 18/20 VUs  42.8s/50.0s

running (46.0s), 14/20 VUs, 218 complete and 0 interrupted iterations
product_browsing   [  88% ] 14/20 VUs  43.8s/50.0s

running (47.0s), 14/20 VUs, 224 complete and 0 interrupted iterations
product_browsing   [  90% ] 14/20 VUs  44.8s/50.0s

running (48.0s), 14/20 VUs, 226 complete and 0 interrupted iterations
product_browsing   [  92% ] 14/20 VUs  45.8s/50.0s

running (49.0s), 11/20 VUs, 231 complete and 0 interrupted iterations
product_browsing   [  94% ] 11/20 VUs  46.8s/50.0s

running (50.0s), 08/20 VUs, 235 complete and 0 interrupted iterations
product_browsing   [  96% ] 08/20 VUs  47.8s/50.0s

running (51.0s), 06/20 VUs, 238 complete and 0 interrupted iterations
product_browsing   [  98% ] 06/20 VUs  48.8s/50.0s

running (52.0s), 04/20 VUs, 240 complete and 0 interrupted iterations
product_browsing   [ 100% ] 04/20 VUs  49.8s/50.0s

running (53.0s), 01/20 VUs, 243 complete and 0 interrupted iterations
product_browsing ↓ [ 100% ] 04/20 VUs  50s


  █ THRESHOLDS 

    http_req_duration
    ✓ 'p(95)<500' p(95)=306.27ms

    http_req_failed
    ✗ 'rate<0.01' rate=49.49%


  █ TOTAL RESULTS 

    checks_total.......: 493    9.234854/s
    checks_succeeded...: 50.50% 249 out of 493
    checks_failed......: 49.49% 244 out of 493

    ✓ warmup products 200
    ✓ GET /products is 200
    ✗ GET /products/{id} is 200
      ↳  0% — ✓ 0 / ✗ 244

    HTTP
    http_req_duration..............: avg=193.68ms min=79.28ms med=164.94ms max=337.21ms p(90)=301.88ms p(95)=306.27ms p(99)=323.14ms
      { expected_response:true }...: avg=123.64ms min=79.28ms med=145.37ms max=173.24ms p(90)=158.29ms p(95)=162.9ms  p(99)=166.73ms
    http_req_failed................: 49.49% 244 out of 493
    http_reqs......................: 493    9.234854/s

    EXECUTION
    iteration_duration.............: avg=3.42s    min=2.39s   med=3.42s    max=4.38s    p(90)=3.96s    p(95)=4.11s    p(99)=4.27s   
    iterations.....................: 244    4.570597/s
    vus............................: 1      min=0          max=20
    vus_max........................: 20     min=20         max=20

    NETWORK
    data_received..................: 833 kB 16 kB/s
    data_sent......................: 61 kB  1.1 kB/s




running (53.4s), 00/20 VUs, 244 complete and 0 interrupted iterations
product_browsing ✓ [ 100% ] 00/20 VUs  50s
time="2026-02-22T10:53:49-05:00" level=error msg="thresholds on metrics 'http_req_failed' have been crossed"
